fecha,imagen,nombre,distribuidor,precio
06-04-2023,https://m.media-amazon.com/images/I/61JNPqSDvdS._AC_UY218_.jpg,davines champú - 280 ml,OhPeluqueros,"20,34 €"
06-04-2023,https://m.media-amazon.com/images/I/8171xcBNwDL._AC_UY218_.jpg,davines more inside curl building serum - 250 ml,OhPeluqueros,"21,29 €"
06-04-2023,https://m.media-amazon.com/images/I/61R0Gfz7SoL._AC_UY218_.jpg,davines champú love smoothing - 250 ml,OhPeluqueros,"18,79 €"
06-04-2023,,charlemagne spray de sal marina para el cabello - spray de agua salada - sea salt spray hair men - spray de volumen textura para el cabello - spray de agua salada mate - spray ondas de playa,OhPeluqueros,
06-04-2023,https://m.media-amazon.com/images/I/71ONvn43fDL._AC_UY218_.jpg,davines naturaltech replumping acondicionador 150 ml,OhPeluqueros,"18,00 €"
06-04-2023,https://m.media-amazon.com/images/I/71yxX4UvCeL._AC_UY218_.jpg,davines oi oil 50ml,OhPeluqueros,"15,08 €"
06-04-2023,https://m.media-amazon.com/images/I/71OgThhD4dL._AC_UY218_.jpg,davines nourishing vegetarian miracle conditionernew 2019 250 ml,OhPeluqueros,"30,00 €"
06-04-2023,https://m.media-amazon.com/images/I/61V8qv2YdYL._AC_UY218_.jpg,davines oi absolute beautifying acondicionador - 250 ml,OhPeluqueros,"22,70 €"
06-04-2023,https://m.media-amazon.com/images/I/81Oaf-dCApL._AC_UY218_.jpg,"davines natural tech energizing – champú para cabellos finos, fragiles y con tendencia a la caída",OhPeluqueros,"18,99 €"
06-04-2023,https://m.media-amazon.com/images/I/71eQCAdLgUL._AC_UY218_.jpg,davines oi oil absolute beautifying potion 135 ml,OhPeluqueros,"38,90 €"
06-04-2023,https://m.media-amazon.com/images/I/61efmekJOJL._AC_UY218_.jpg,davines natural tech purifying shampoo (for scalp with oily or dry dan.,OhPeluqueros,"20,24 €"
06-04-2023,https://m.media-amazon.com/images/I/71XAYvBZTkL._AC_UY218_.jpg,davines heart of glass silkening champu 250 ml,OhPeluqueros,"19,90 €"
06-04-2023,https://m.media-amazon.com/images/I/71kMQxQ4VHL._AC_UY218_.jpg,davines naturaltech replumping champú 250 ml,OhPeluqueros,"18,00 €"
06-04-2023,https://m.media-amazon.com/images/I/615TtgIbd1L._AC_UY218_.jpg,davines momo moisturizing conditioner (for dry or dehydrated hair) 250.,OhPeluqueros,"20,01 €"
06-04-2023,https://m.media-amazon.com/images/I/7101O1RUYlL._AC_UY218_.jpg,davines essential champú dede 295000 g,OhPeluqueros,"17,99 €"
06-04-2023,https://m.media-amazon.com/images/I/71hXwUbVknL._AC_UY218_.jpg,davines love lovely curl enchancing shampoo (for wavy or curly hair) 2.,OhPeluqueros,"18,75 €"
06-04-2023,https://m.media-amazon.com/images/I/81rSIbr2v9L._AC_UY218_.jpg,"davines 69230 - champú, 250 ml",OhPeluqueros,"19,99 €"
06-04-2023,https://m.media-amazon.com/images/I/61VFtW881fL._AC_UY218_.jpg,"davines momo - champú, 250 ml (881-42109)",OhPeluqueros,"17,99 €"
06-04-2023,https://m.media-amazon.com/images/I/71IXlMO4HRL._AC_UY218_.jpg,davines love smooth mask 250ml disciplinante nuevo formato,OhPeluqueros,"26,00 €"
06-04-2023,https://m.media-amazon.com/images/I/51tqI4Llw6L._AC_UY218_.jpg,"davines minu - champú, 250 ml",OhPeluqueros,"17,64 €"
06-04-2023,https://m.media-amazon.com/images/I/61R-3hKN0xL._AC_UY218_.jpg,davines melu acondicionador 250 ml,OhPeluqueros,"22,50 €"
06-04-2023,https://m.media-amazon.com/images/I/8142knfncSL._AC_UY218_.jpg,davines naturaltech nourishing hair building pak 250 ml,OhPeluqueros,"36,74 €"
06-04-2023,https://m.media-amazon.com/images/I/618XsBsIeZL._AC_UY218_.jpg,davines essential acondicionador nounou 250 ml - 250 ml,OhPeluqueros,"22,24 €"
06-04-2023,https://m.media-amazon.com/images/I/810MXgsHc3L._AC_UY218_.jpg,davines more inside medium hold modelling gel 250ml,OhPeluqueros,"21,55 €"
06-04-2023,https://m.media-amazon.com/images/I/614MHILl3bL._AC_UY218_.jpg,"davines volu - champú, 250 ml",OhPeluqueros,"18,30 €"
06-04-2023,https://m.media-amazon.com/images/I/61PkAII-MvL._AC_UY218_.jpg,davines davines love mask rizo 250ml 250 ml,OhPeluqueros,"23,69 €"
06-04-2023,https://m.media-amazon.com/images/I/51B+6TcPl0L._AC_UY218_.jpg,davines nourishing naturaltech shampoo 250 ml,OhPeluqueros,"19,75 €"
06-04-2023,https://m.media-amazon.com/images/I/614obxZHuqL._AC_UY218_.jpg,"davines love curl controller - crema para cabello, 150 ml",OhPeluqueros,"22,47 €"
06-04-2023,https://m.media-amazon.com/images/I/61frKUCrCDL._AC_UY218_.jpg,davines heart of glass rich acondicionador 250 ml,OhPeluqueros,"26,33 €"
06-04-2023,https://m.media-amazon.com/images/I/41cxszUCo6L._AC_UY218_.jpg,davines love curl conditioner 250ml - acondicionador elastificante y controlador para cabello ondulado o rizado - new pak 2022,OhPeluqueros,"21,70 €"
06-04-2023,https://m.media-amazon.com/images/I/617hFXLgy1L._AC_UY218_.jpg,davines essential melu shampoo 250 ml,OhPeluqueros,"17,80 €"
06-04-2023,https://m.media-amazon.com/images/I/71tIhwnP-qL._AC_UY218_.jpg,davines solu clarifying champú - 1000 ml,OhPeluqueros,"46,15 €"
06-04-2023,https://m.media-amazon.com/images/I/81OOWiPkwGL._AC_UY218_.jpg,davines naturaltech detoxifying scrub champú 250 ml,OhPeluqueros,"19,88 €"
06-04-2023,https://m.media-amazon.com/images/I/51BUnKgpjuL._AC_UY218_.jpg,davines natural tech renewing shampoo (for all scalp and hair types) 1000ml,OhPeluqueros,"54,20 €"
06-04-2023,https://m.media-amazon.com/images/I/71gKC7wdp3L._AC_UY218_.jpg,davines nourishing keratin sealer 100 ml,OhPeluqueros,"24,29 €"
06-04-2023,https://m.media-amazon.com/images/I/51lRZCTGsoL._AC_UY218_.jpg,"natural tech by davines - paquete nutritivo para el cabello, 250 ml",OhPeluqueros,"36,45 €"
06-04-2023,https://m.media-amazon.com/images/I/61eQxA53VLL._AC_UY218_.jpg,davines essential nounou mask 250 ml - 250 ml,OhPeluqueros,"24,00 €"
06-04-2023,https://m.media-amazon.com/images/I/71eFvoUytHL._AC_UY218_.jpg,"davines minu - acondicionador, 250 ml",OhPeluqueros,"20,25 €"
06-04-2023,https://m.media-amazon.com/images/I/4106nl5FlPL._AC_UY218_.jpg,davines naturaltech purifying shampoo - 1000 ml,OhPeluqueros,"54,24 €"
06-04-2023,https://m.media-amazon.com/images/I/61mzpZS4r9L._AC_UY218_.jpg,davines liquid spell 125ml,OhPeluqueros,"36,15 €"
06-04-2023,https://m.media-amazon.com/images/I/617LFfN0y2L._AC_UY218_.jpg,davines essential solu champú 400 g (881-14861),OhPeluqueros,"17,99 €"
06-04-2023,https://m.media-amazon.com/images/I/61c4QBP+YzS._AC_UY218_.jpg,"davines, spray de texturización en seco, 250 ml",OhPeluqueros,"24,00 €"
06-04-2023,https://m.media-amazon.com/images/I/81E1Y8fq5DL._AC_UY218_.jpg,davines aceite non oil - 250 ml,OhPeluqueros,"23,50 €"
06-04-2023,https://m.media-amazon.com/images/I/71nUNV--jVL._AC_UY218_.jpg,davines essential haircare love curl cleansing cream - 500 ml,OhPeluqueros,"30,73 €"
06-04-2023,https://m.media-amazon.com/images/I/41dMkLTx-xL._AC_UY218_.jpg,davines essential melu conditioner 250 ml - 250 ml,OhPeluqueros,"20,02 €"
06-04-2023,https://m.media-amazon.com/images/I/71VKDzk0r1L._AC_UY218_.jpg,davines essential haircare oi/shampoo - absolute beautifying shampoo.,OhPeluqueros,"54,65 €"
06-04-2023,https://m.media-amazon.com/images/I/81aUdq7DtvL._AC_UY218_.jpg,davines momo moisturizing acondicionador - 250 ml,OhPeluqueros,"22,39 €"
06-04-2023,https://m.media-amazon.com/images/I/71aVr2pYQCL._AC_UY218_.jpg,davines eh love curl acondicionador - 250 ml,OhPeluqueros,"24,90 €"
06-04-2023,https://m.media-amazon.com/images/I/61lQ8RVz8nL._AC_UY218_.jpg,davines alchemic system alchemic conditioner silver 250ml.,OhPeluqueros,"26,20 €"
06-04-2023,https://m.media-amazon.com/images/I/61XU1lKKl2L._AC_UY218_.jpg,davines alchemic shampoo - # copper (for natural & coloured hair) 280ml,OhPeluqueros,"20,00 €"
06-04-2023,https://m.media-amazon.com/images/I/51kbNfy9-nL._AC_UY218_.jpg,davines naturaltech nourishing shampoo 1000ml - champú nutritivo,OhPeluqueros,"53,90 €"
06-04-2023,https://m.media-amazon.com/images/I/418h55GPzuL._AC_UY218_.jpg,davines nounou shampoo 400 g,OhPeluqueros,"52,95 €"
06-04-2023,https://m.media-amazon.com/images/I/51RyADiTaGL._AC_UY218_.jpg,davines naturaltech well being shampoo 1000 ml - 100 ml,OhPeluqueros,"54,20 €"
06-04-2023,https://m.media-amazon.com/images/I/61B0ExDnZOL._AC_UY218_.jpg,davines - naturaltech energizing gel 150 ml-unisex,OhPeluqueros,"30,00 €"
06-04-2023,https://m.media-amazon.com/images/I/61-M4CL5CLL._AC_UY218_.jpg,"davines love curl crème - cuidado capilar, 150 ml",OhPeluqueros,"25,50 €"
06-04-2023,https://m.media-amazon.com/images/I/716gvvoUnwL._AC_UY218_.jpg,davines more inside relaxing moisturizing fluid crema - 125 ml,OhPeluqueros,"19,08 €"
06-04-2023,https://m.media-amazon.com/images/I/81JMS-Sm-yL._AC_UY218_.jpg,davines alchemic silver champú 280 9460 g,OhPeluqueros,"18,99 €"
06-04-2023,https://m.media-amazon.com/images/I/61MBuRtgobL._AC_UY218_.jpg,- davines - alchemic. champú dorado. envase de 280 ml,OhPeluqueros,"21,00 €"
06-04-2023,https://m.media-amazon.com/images/I/61GqXtIRJsL._AC_UY218_.jpg,"davines - spray sin gas para fijación de pelo, 250 ml",OhPeluqueros,"27,95 €"
06-04-2023,https://m.media-amazon.com/images/I/61Q5TMcwrLL._AC_UY218_.jpg,davines – dede delicate daily conditioner (for all hair types) 250 ml/8.45oz,OhPeluqueros,"20,20 €"
06-04-2023,https://m.media-amazon.com/images/I/413LeWVOkHL._AC_UY218_.jpg,"davines 75098-d melu champú, 1000 ml",OhPeluqueros,"53,00 €"
06-04-2023,https://m.media-amazon.com/images/I/41xzRw9UBYL._AC_UY218_.jpg,davines essential haircare love curl revitalizer 75ml,OhPeluqueros,"10,50 €"
06-04-2023,https://m.media-amazon.com/images/I/71o8CKYFrSL._AC_UY218_.jpg,davines – love curl shampoo davines formato viaje 75 ml,OhPeluqueros,"10,50 €"
06-04-2023,https://m.media-amazon.com/images/I/81q7YTG7isL._AC_UY218_.jpg,davines natural tech renewing - tratamiento acondicionador para todo tipo de cabello y escalada (250 ml),OhPeluqueros,"24,10 €"
06-04-2023,https://m.media-amazon.com/images/I/31PCFvLhLJL._AC_UY218_.jpg,davines – nounou nourishing illuminating shampoo – 250 ml/8.45oz by davines,OhPeluqueros,"17,99 €"
06-04-2023,https://m.media-amazon.com/images/I/71jCdgfrWcL._AC_UY218_.jpg,davines concentrado para el cabello - 150 ml,OhPeluqueros,"29,50 €"
06-04-2023,https://m.media-amazon.com/images/I/61aNnP2A17L._AC_UY218_.jpg,davines dede conditioner 250ml,OhPeluqueros,"20,41 €"
06-04-2023,https://m.media-amazon.com/images/I/71att2cfWIL._AC_UY218_.jpg,"davines ntech champú calmante 200 g, 250 ml",OhPeluqueros,"21,80 €"
06-04-2023,https://m.media-amazon.com/images/I/71pOFoXkvJL._AC_UY218_.jpg,oi oil olio di bellezza assoluta multipack 3x135ml davines,OhPeluqueros,"112,06 €"
06-04-2023,https://m.media-amazon.com/images/I/71rhRX9JXsL._AC_UY218_.jpg,"davines dede hair mist - cuidado capilar, 250 gr",OhPeluqueros,"30,95 €"
06-04-2023,https://m.media-amazon.com/images/I/51doV2V7d-L._AC_UY218_.jpg,davines minu champú illuminating protective champú (for coloured hair) 1000 ml/33.8oz,OhPeluqueros,"53,00 €"
06-04-2023,https://m.media-amazon.com/images/I/61xxEak4z4L._AC_UY218_.jpg,leche todo-en-uno de davines oi.,OhPeluqueros,"71,99 €"
06-04-2023,https://m.media-amazon.com/images/I/61lKj2+OR5L._AC_UY218_.jpg,davines alchemic conditioner - # tobacco (for natural & coloured hair) 250ml,OhPeluqueros,"30,50 €"
06-04-2023,https://m.media-amazon.com/images/I/71DJ2jgV7XL._AC_UY218_.jpg,davines more inside texturizing dust 8gr (12085),OhPeluqueros,"23,80 €"
06-04-2023,https://m.media-amazon.com/images/I/31-SwB7cmBL._AC_UY218_.jpg,davines dede delicate ritual shampoo 1000ml,OhPeluqueros,"53,00 €"
06-04-2023,https://m.media-amazon.com/images/I/61bBoVH9RNS._AC_UY218_.jpg,davines love curl set shampoo + conditioner,OhPeluqueros,"43,20 €"
06-04-2023,https://m.media-amazon.com/images/I/71GBdxe2OWL._AC_UY218_.jpg,davines oi acondicionador - 1000 ml,OhPeluqueros,"77,77 €"
06-04-2023,https://m.media-amazon.com/images/I/31XybWIAsWL._AC_UY218_.jpg,davines love smoothing acondicionador,OhPeluqueros,"11,95 €"
06-04-2023,https://m.media-amazon.com/images/I/71kvCz8u76L._AC_UY218_.jpg,davines more inside medium hold pliable paste - 125 ml,OhPeluqueros,"23,93 €"
06-04-2023,https://m.media-amazon.com/images/I/81XF-GgYhUL._AC_UY218_.jpg,davines more inside invisible serum efecto día despues - 50 ml,OhPeluqueros,"19,00 €"
06-04-2023,https://m.media-amazon.com/images/I/617Cb9LDmlL._AC_UY218_.jpg,davines essential acondicionador love disciplinante 1000 ml - 1000 ml,OhPeluqueros,"76,49 €"
06-04-2023,https://m.media-amazon.com/images/I/31kodxmH2ML._AC_UY218_.jpg,davines love smooth champú 1000 ml,OhPeluqueros,"55,95 €"
06-04-2023,https://m.media-amazon.com/images/I/814Az5MT9xL._AC_UY218_.jpg,davines naturaltech replumping hair filler superactivo 100 ml,OhPeluqueros,"29,86 €"
06-04-2023,https://m.media-amazon.com/images/I/51Bm2wkW-aL._AC_UY218_.jpg,davines naturaltech energizing superactive 100ml.,OhPeluqueros,"75,70 €"
06-04-2023,https://m.media-amazon.com/images/I/71QJvwDKQPL._AC_UY218_.jpg,davines melu escudo - 250 ml.,OhPeluqueros,"33,49 €"
06-04-2023,https://m.media-amazon.com/images/I/41yXNSoDQ4L._AC_UY218_.jpg,davines ntech champú regulador 154000 g,OhPeluqueros,"53,00 €"
06-04-2023,https://m.media-amazon.com/images/I/61KmAGIP4eL._AC_UY218_.jpg,davines alchemic shampoo chocolate 280ml - champú para cabello castaño oscuro,OhPeluqueros,"21,75 €"
06-04-2023,https://m.media-amazon.com/images/I/71kTypzJCUL._AC_UY218_.jpg,"davines dededede barra de champú, 3.53 oz",OhPeluqueros,"23,50 €"
06-04-2023,https://m.media-amazon.com/images/I/71MGDlRpMEL._AC_UY218_.jpg,"davines love curl primer - leche nutritiva para cabello ondulado, 150 ml",OhPeluqueros,"24,00 €"
06-04-2023,https://m.media-amazon.com/images/I/61LHp8f1xwL._AC_UY218_.jpg,davines alchemic conditioner red (for natural & red or mahogany hair) 250ml,OhPeluqueros,"30,50 €"
06-04-2023,https://m.media-amazon.com/images/I/71BBkSF179L._AC_UY218_.jpg,davines serum para el cabello - 150 ml,OhPeluqueros,"21,00 €"
06-04-2023,https://m.media-amazon.com/images/I/71PNOSvlBFL._AC_UY218_.jpg,davines naturaltech well being acondicionador 150 ml,OhPeluqueros,"21,25 €"
06-04-2023,https://m.media-amazon.com/images/I/61cid+W5wCL._AC_UY218_.jpg,davines this is a curl gel oil 250ml new,OhPeluqueros,"23,48 €"
06-04-2023,https://m.media-amazon.com/images/I/71eW1ni6gFL._AC_UY218_.jpg,"davines volu hair mist - cuidado capilar, 250 ml",OhPeluqueros,"28,15 €"
06-04-2023,https://m.media-amazon.com/images/I/51xLgXEdmgS._AC_UY218_.jpg,davines nourishing vegetarian miracle acondicionador 1000 ml,OhPeluqueros,"84,25 €"
06-04-2023,https://m.media-amazon.com/images/I/61tsFM2rmPL._AC_UY218_.jpg,"daviness, cuidado del pelo y del cuero cabelludo - 250 ml",OhPeluqueros,"21,53 €"
06-04-2023,https://m.media-amazon.com/images/I/71DIWD0qxYL._AC_UY218_.jpg,davines naturaltech energizing thickening hair tonic 100ml,OhPeluqueros,"37,19 €"
06-04-2023,https://m.media-amazon.com/images/I/61RbiSSkGIL._AC_UY218_.jpg,davines minu – conditioner illuminating protective conditioner (for coloured hair) 1000 ml/33.8oz,OhPeluqueros,"76,50 €"
06-04-2023,https://m.media-amazon.com/images/I/71Tq+sCMsSL._AC_UY218_.jpg,davines dede delicate acondicionador - 1000 ml,OhPeluqueros,"76,49 €"
06-04-2023,https://m.media-amazon.com/images/I/510yPHWoVjL._AC_UY218_.jpg,naturaltech natural tech mini productos champú energizante - 100 ml,OhPeluqueros,"11,25 €"
06-04-2023,https://m.media-amazon.com/images/I/41MnXkzjmIL._AC_UY218_.jpg,davines ntech champú well-being 200 g,OhPeluqueros,"21,30 €"
06-04-2023,https://m.media-amazon.com/images/I/71sbIPWYY1L._AC_UY218_.jpg,"davines love smoothing - champú, 250 ml",OhPeluqueros,"21,89 €"
06-04-2023,https://m.media-amazon.com/images/I/81rs2B2caeL._AC_UY218_.jpg,davines naturaltech energizing superactive 100 ml,OhPeluqueros,"76,35 €"
06-04-2023,https://m.media-amazon.com/images/I/81PEt-WpV9L._AC_UY218_.jpg,naturaltech natural tech mini productos champú replumping - 100 ml,OhPeluqueros,"12,11 €"
06-04-2023,https://m.media-amazon.com/images/I/71dX3P3mneL._AC_UY218_.jpg,"daviness, acondicionador de pelo - 75 gr.",OhPeluqueros,"10,57 €"
06-04-2023,https://m.media-amazon.com/images/I/81gI5MxdyiL._AC_UY218_.jpg,davines alchemic system acondicionador chocolate - 250 ml,OhPeluqueros,"30,69 €"
06-04-2023,https://m.media-amazon.com/images/I/31pHOvXV4sL._AC_UY218_.jpg,davines essential haircare nounou conditioner 1000ml/33.8oz (salon size) by davines,OhPeluqueros,"66,09 €"
06-04-2023,https://m.media-amazon.com/images/I/71Gd2tDswFL._AC_UY218_.jpg,davines minu illuminating mascarilla para el pelo - 1000 ml,OhPeluqueros,"86,45 €"
06-04-2023,https://m.media-amazon.com/images/I/31WfmI0AeIL._AC_UY218_.jpg,"davines, set de regalo de pelo - 400 ml.",OhPeluqueros,"23,06 €"
06-04-2023,https://m.media-amazon.com/images/I/511e0QXqKXL._AC_UY218_.jpg,davines love curl revitalizer - 250 ml,OhPeluqueros,"30,00 €"
06-04-2023,https://m.media-amazon.com/images/I/71Kyra1kUGL._AC_UY218_.jpg,davines naturaltech tratamiento anticaida cabello 6 ml,OhPeluqueros,"70,54 €"
06-04-2023,https://m.media-amazon.com/images/I/71xHsEc-wcL._AC_UY218_.jpg,davines naturaltech renewing serum superactive 100ml.,OhPeluqueros,"54,23 €"
06-04-2023,https://m.media-amazon.com/images/I/61884qFLFaL._AC_UY218_.jpg,davines naturaltech energizing loción 12 x 6 ml,OhPeluqueros,"74,98 €"
06-04-2023,https://m.media-amazon.com/images/I/31WfmI0AeIL._AC_UY218_.jpg,"davines, set de regalo de pelo - 400 ml.",OhPeluqueros,"23,06 €"
06-04-2023,https://m.media-amazon.com/images/I/511e0QXqKXL._AC_UY218_.jpg,davines love curl revitalizer - 250 ml,OhPeluqueros,"30,00 €"
06-04-2023,https://m.media-amazon.com/images/I/71Kyra1kUGL._AC_UY218_.jpg,davines naturaltech tratamiento anticaida cabello 6 ml,OhPeluqueros,"70,54 €"
06-04-2023,https://m.media-amazon.com/images/I/71xHsEc-wcL._AC_UY218_.jpg,davines naturaltech renewing serum superactive 100ml.,OhPeluqueros,"54,23 €"
06-04-2023,https://m.media-amazon.com/images/I/61884qFLFaL._AC_UY218_.jpg,davines naturaltech energizing loción 12 x 6 ml,OhPeluqueros,"74,98 €"
06-04-2023,https://m.media-amazon.com/images/I/51UjdZrDvqL._AC_UY218_.jpg,davines energizing seasonal hair treatment 12x6ml,OhPeluqueros,"82,99 €"
06-04-2023,https://m.media-amazon.com/images/I/61ty+VqVwoL._AC_UY218_.jpg,davines natural tech detoxifying scrub shampoo (for atonic scalp) 1000ml,OhPeluqueros,"54,20 €"
06-04-2023,https://m.media-amazon.com/images/I/31YIgkiiFXL._AC_UY218_.jpg,davines – natural de tech well being conditioner 1000 ml/33.8oz,OhPeluqueros,"65,00 €"
06-04-2023,https://m.media-amazon.com/images/I/41utixM+ylL._AC_UY218_.jpg,davines more inside shimmering mist - 200 ml,OhPeluqueros,"23,74 €"
06-04-2023,https://m.media-amazon.com/images/I/61hJhHUTnrL._AC_UY218_.jpg,davines pasta&love pre shaving & beard oil 50ml,OhPeluqueros,"26,75 €"
06-04-2023,https://m.media-amazon.com/images/I/71qcxoevlCL._AC_UY218_.jpg,davines – natural tech renewing conditioning treatment (for all scalp and hair types) 1000 ml/33.81oz,OhPeluqueros,"73,89 €"
06-04-2023,https://m.media-amazon.com/images/I/41s4R5HomqL._AC_UY218_.jpg,"davines, set de regalo de pelo - 100 ml.",OhPeluqueros,"12,50 €"
06-04-2023,https://m.media-amazon.com/images/I/41YYCO1U9vL._AC_UY218_.jpg,davines natural tech replumping shampoo 250 ml 8.45 oz by shampoo & conditioner,OhPeluqueros,"22,25 €"
06-04-2023,https://m.media-amazon.com/images/I/515UULu5HlL._AC_UY218_.jpg,davines elevating clay supercleanser 120g,OhPeluqueros,"112,75 €"
06-04-2023,https://m.media-amazon.com/images/I/61orhAryb+L._AC_UY218_.jpg,davines r renewing pro boost superactivo 500 ml.,OhPeluqueros,"66,50 €"
06-04-2023,https://m.media-amazon.com/images/I/61BllWB2D1L._AC_UY218_.jpg,"daviness, filtro solar corporal - 150 gr.",OhPeluqueros,"20,16 €"
06-04-2023,https://m.media-amazon.com/images/I/61Cx88pHWBL._AC_UY218_.jpg,davines nounou nourishing mascarilla para el pelo - 1000 ml,OhPeluqueros,"86,50 €"
06-04-2023,https://m.media-amazon.com/images/I/61BqJCWy4bL._AC_UY218_.jpg,skeyndor essential mini productos acondicionador minu - 75 ml,OhPeluqueros,"9,90 €"
06-04-2023,https://m.media-amazon.com/images/I/61nb14V0QNL._AC_UY218_.jpg,"champú davines dede, 8 oz.",OhPeluqueros,"41,93 €"
06-04-2023,https://m.media-amazon.com/images/I/716G9PJu7TL._AC_UY218_.jpg,"redken | champú hidratante con aceite de argán para cabello seco y frágil, all soft, 300 ml",OhPeluqueros,"17,80 €"
06-04-2023,https://m.media-amazon.com/images/I/512TjUhewUL._AC_UY218_.jpg,"tahe gold radiance champú para cabellos rubios y con mechas iluminador con oro líquido, queratina pura y reflectores de luz, 300 ml",OhPeluqueros,"9,19 €"
06-04-2023,https://m.media-amazon.com/images/I/41TsgpnDpKL._AC_UY218_.jpg,davines sun protective stick spf 50+ - 9 ml,OhPeluqueros,"14,90 €"
06-04-2023,https://m.media-amazon.com/images/I/61Sk9fwSlGL._AC_UY218_.jpg,"daviness, acondicionador de pelo - 75 gr.",OhPeluqueros,"10,50 €"
06-04-2023,https://m.media-amazon.com/images/I/51aNLmOiWBL._AC_UY218_.jpg,"l'oréal professionnel | champú metal detox, para un cabello suave, brillante y sedoso, color más duradero, textura rica y cremosa, sin sulfatos, para todo tipo de cabello, 300ml",OhPeluqueros,"18,13 €"
06-04-2023,https://m.media-amazon.com/images/I/51U8Nq9yxIL._AC_UY218_.jpg,desintoxicante champú 1l,OhPeluqueros,"54,25 €"
06-04-2023,https://m.media-amazon.com/images/I/61DipDlPqRL._AC_UY218_.jpg,"daviness, acondicionador de pelo - 75 gr.",OhPeluqueros,"10,58 €"
06-04-2023,https://m.media-amazon.com/images/I/31bN+JWylJL._AC_UY218_.jpg,natural tech replumping acondicionado (para todo tipo de pelo) 1000 ml/33.8oz,OhPeluqueros,"71,00 €"
06-04-2023,https://m.media-amazon.com/images/I/81X9QT40eRL._AC_UY218_.jpg,alchemic red acondicionador - 250 ml,OhPeluqueros,"27,05 €"
06-04-2023,https://m.media-amazon.com/images/I/313eZ7kPYpL._AC_UY218_.jpg,natural tech gel energizante (para cuero cabelludo y frágil adelgazamiento del cabello) 150 ml/5.07oz,OhPeluqueros,"30,00 €"
06-04-2023,https://m.media-amazon.com/images/I/517O+heTG8L._AC_UY218_.jpg,phyto phyto 7 crema dia 50 ml - 50 ml,OhPeluqueros,"27,50 €"
06-04-2023,https://m.media-amazon.com/images/I/617w7+uuY9L._AC_UY218_.jpg,"l’oréal professionnel | champú protector de color con resveratrol, para pelo teñido, vitamino color, serie expert, 500ml",OhPeluqueros,"28,40 €"
06-04-2023,https://m.media-amazon.com/images/I/816IvMudwCL._AC_UY218_.jpg,"daviness, acondicionador de pelo - 125 gr.",OhPeluqueros,"17,60 €"
06-04-2023,https://m.media-amazon.com/images/I/71GfuzBdvmL._AC_UY218_.jpg,"l'oréal professionnel | champú reparador e iluminador para pelo con mechas o rubio, blondifier gloss, serie expert, 750ml",OhPeluqueros,"29,50 €"
06-04-2023,https://m.media-amazon.com/images/I/51obCwp2FnL._AC_UY218_.jpg,"tahe organic care tinte orgánico permanente para el cabello de larga duración sin amoniaco, 100 ml, tono 9.1 rubio muy claro ceniza",OhPeluqueros,"17,29 €"
06-04-2023,https://m.media-amazon.com/images/I/61a3FeJjP9L._AC_UY218_.jpg,alfa pigments ultraviolet 90ml,OhPeluqueros,"23,01 €"
06-04-2023,https://m.media-amazon.com/images/I/614Oe73A4OL._AC_UY218_.jpg,"l’oréal professionnel | champú neutralizante de tonos anaranjados, para cabellos castaños, textura cremosa con pigmentos azules, chroma crème, serie expert, 500 ml",OhPeluqueros,"14,50 €"
06-04-2023,https://m.media-amazon.com/images/I/41ZIde9-7WL._AC_UY218_.jpg,naturaltech well being conditioner 150 ml,OhPeluqueros,"18,96 €"
06-04-2023,https://m.media-amazon.com/images/I/41BelQI8C4L._AC_UY218_.jpg,salerm champu - 250 ml.,OhPeluqueros,"15,76 €"
06-04-2023,https://m.media-amazon.com/images/I/71VDd-2i5+L._AC_UY218_.jpg,"daviness, filtro solar corporal - 280 gr.",OhPeluqueros,"15,87 €"
06-04-2023,https://m.media-amazon.com/images/I/519PBILmHAL._AC_UY218_.jpg,"sebastian texturizer, cuidado del pelo y del cuero cabelludo - 150 ml.",OhPeluqueros,"22,88 €"
06-04-2023,https://m.media-amazon.com/images/I/61wjVYM653L._AC_UY218_.jpg,salerm cosmetics 21 250 ml,OhPeluqueros,"13,74 €"
06-04-2023,https://m.media-amazon.com/images/I/51yWCrM8r1L._AC_UY218_.jpg,"l'oréal professionnel | mascarilla protectora de color con resveratrol, para pelo teñido, vitamino color, serie expert, 250ml",OhPeluqueros,"19,05 €"
06-04-2023,https://m.media-amazon.com/images/I/51aUFZdfd7L._AC_UY218_.jpg,"tahe gold protein champú protector para cabellos opacos, teñidos o con mechas con efecto antiencrespamiento (1000 ml)",OhPeluqueros,"19,95 €"
06-04-2023,https://m.media-amazon.com/images/I/71RjVAaX4BL._AC_UY218_.jpg,"redken | mascarilla reparadora con proteínas para cabello dañado, extreme strength builder plus, formato 250 ml",OhPeluqueros,"21,66 €"
06-04-2023,https://m.media-amazon.com/images/I/511X12MuKGL._AC_UY218_.jpg,"alfaparf fluido, único, banana, 125 mililitro",OhPeluqueros,"21,07 €"
06-04-2023,https://m.media-amazon.com/images/I/41V4cXZhVjL._AC_UY218_.jpg,"l'oreal professionnel expert blondifier gloss, champú, 500 ml",OhPeluqueros,"26,90 €"
06-04-2023,https://m.media-amazon.com/images/I/51V1T6Jc12L._AC_UY218_.jpg,olaplex perfeccionador capilar tratamiento reparador n.° 3 100ml (paquete de 1),OhPeluqueros,"27,99 €"
06-04-2023,https://m.media-amazon.com/images/I/51Hnke7KENL._AC_UY218_.jpg,"l'oréal professionnel | champú fortalecedor para cabellos largos, frágiles y quebradizos, inforcer, serie expert, 300 ml",OhPeluqueros,"13,95 €"
06-04-2023,https://m.media-amazon.com/images/I/51Hnke7KENL._AC_UY218_.jpg,"l'oréal professionnel | champú fortalecedor para cabellos largos, frágiles y quebradizos, inforcer, serie expert, 300 ml",OhPeluqueros,"13,95 €"
